### DISCUSSION TITLE
Random lost of events with eKuiper HTTP Push Stream Source

### DISCUSSION THREAD

**Discussion by canob** [lf-edge/ekuiper#2382] [Q&A]
**[ ORIGINAL DESCRIPTION, THAT FINALLY IS NOT THE PROBLEM, SEE MY NEXT COMMENT]**
Hi everyone,
I'm trying to match a field, qname, ended with ".me" or ".xyz" or ".biz", with SQL LIKE operator (reviewed this doc to know how to use LIKE, https://ekuiper.org/docs/en/latest/sqls/query_language_elements.html#where)
I created a rule:
`SELECT * FROM dns WHERE qname LIKE "%.me" OR qname LIKE "%.xyz" OR qname LIKE "%.biz"`
And the rule has sink to a file, but anything is being written to the file.
For example, my expectation is that this log is being captured by the rule:
`{"query_type":"AAAA","source_ip":"10.11.0.45","tag":"dns_detections_uncommon_TLDs","timestamp":"Oct 31 11:09:35","qname":"testing.me"}`
Do I need to scape the dot using LIKE? How? Or why is not working?
Thanks in advance for your help.

**Comment by canob** [comment]
At the end, the problem is with the HTTP Push Source...
Randomly, the HTTP Push Source receive one, two, or the three test events that I generate doing DNS queries (one with a domain ended with .me, one with a domain ended with .biz, and one with a domain ended with .xyz), events that are being collected by FluentBit, and sended using FluentBit HTTP Output to eKuiper HTTP Push Source, and that random behavior is the reason because the rule sends one, two or three events to the destination file, rule that is based on the configured SQL query, `SELECT * FROM dns WHERE qname LIKE "%.me" OR qname LIKE "%.xyz" OR qname LIKE "%.biz"`
I think that the problem is in eKuiper Push Source, because I'm sending the same logs with the same FluentBit Instance using FluentBit HTTP Output (same output plugin) to OpenObserve and Parseable, and both are receiving the logs correctly, and additionally I'm sending the logs to a file with FluentBit and to Grafana Loki, and the only destination that is not receiving all the logs randomly is eKuiper using HTTP Push Source.
Any advice on what I can review to troubleshoot the behavior of HTTP Push Source?
The describe of the stream that is failing:
```
root@ekuiper:/kuiper/bin# ./kuiper describe stream dns
Connecting to 127.0.0.1:20498...
Fields
--------------------------------------------------------------------------------

CONF_KEY: default
DATASOURCE: /api/data/dns
FORMAT: json
TIMESTAMP: timestamp
TYPE: httppush
```
And the describe of the rule:
```
root@ekuiper:/kuiper/bin# ./kuiper describe rule dns_detections_uncommon_TLDs
Connecting to 127.0.0.1:20498...
{
  "id": "dns_detections_uncommon_TLDs",
  "name": "dns_detections_uncommon_TLDs",
  "triggered": true,
  "sql": "SELECT * FROM dns WHERE qname LIKE \"%.me\" OR qname LIKE \"%.biz\" OR qname LIKE \"%.xyz\"",
  "actions": [
    {
      "file": {
        "resourceId": "dns",
        "checkInterval": 6000,
        "fileType": "lines",
        "hasHeader": false,
        "path": "/kuiper/output/dns-detections.json",
        "rollingCount": 10000,
        "rollingInterval": 36000,
        "rollingNamePattern": "suffix",
        "omitIfEmpty": false,
        "sendSingle": true,
        "format": "json",
        "bufferLength": 1024,
        "enableCache": false,
        "runAsync": false
      }
    },
    {
      "rest": {
        "resourceId": "dns-fluentbit-output",
        "bodyType": "json",
        "debugResp": false,
        "insecureSkipVerify": true,
        "method": "POST",
        "oauth": {
          "access": {},
          "refresh": {}
        },
        "responseType": "code",
        "timeout": 5000,
        "url": "http://fluentbit-linux:8889",
        "omitIfEmpty": false,
        "sendSingle": true,
        "format": "json",
        "bufferLength": 1024,
        "enableCache": false,
        "runAsync": false
      }
    }
  ],
  "options": {
    "debug": false,
    "logFilename": "",
    "isEventTime": false,
    "lateTolerance": 1000,
    "concurrency": 1,
    "bufferLength": 1024,
    "sendMetaToSink": false,
    "sendError": true,
    "qos": 0,
    "checkpointInterval": 300000,
    "cron": "",
    "duration": "",
    "cronDatetimeRange": null,
    "restartStrategy": {
      "attempts": 0,
      "delay": 1000,
      "multiplier": 2,
      "maxDelay": 30000,
      "jitter": 0.1
    }
  }
}
```

Thanks in advance for your help.

**Reply by ngjaying** [reply]
Please check [How to debug a rule](https://ekuiper.org/docs/en/latest/getting_started/debug_rules.html)

**Reply by canob** [reply]
Hi @ngjaying . Thanks for you answer.
I think the problem is not in the rule, is in the HTTP Push Source, because I have another rule:
`SELECT * FROM dns`
And is happening the same with that rule, the events that are not being captured by the original rule (`SELECT * FROM dns WHERE qname LIKE "%.me" OR qname LIKE "%.xyz" OR qname LIKE "%.biz"`), are not being captured by the new one too, and the new one supposedly is going to capture all the received events. That is the reason I think the problem is in the HTTP Push Source.
Is there any special debug procedure for the Sources? I'm thinking in send all the contain from a fixed JSON file with FluentBit to HTTP Push Source of eKuiper and to other destinations (OpenObserve, Parseable), and compare the amount of events, but with that I'm only going to confirm the mentioned problem, and not get much information about what is happening for debugging.
Any advice?
Thanks in advance for your help.

**Reply by ngjaying** [reply]
What is the throughput of the message sending to http push source? More than 1000 per second? You can enable debug and all received data in httppush will be printed to the log.

**Reply by canob** [reply]
No, less than 1000 per second. I'm going to review how to enable debug in the ekuiper config file to get the data received by httppush printed to the log, for compare.
Thanks for your help @ngjaying , and sorry for continue bothering you with all my questions.

**Reply by ngjaying** [reply]
No problem at all. Thanks for reporting problems.

**Reply by canob** [reply]
@ngjaying, can you tell me how to enable the debbuging you mentioned for httpush to enable all received data to be printed to the log?
Because I changed kuiper.yaml to this:
```
basic:
  # true|false, with debug level, it prints more debug info
  debug: true
  # true|false, if it's set to true, then the log will be print to console
  consoleLog: true
  # true|false, if it's set to true, then the log will be print to log file
  fileLog: true
```
But I still don't seeing received data from httpush on stream.log file after ekuiper docker restart.
Thanks in advance.

**Reply by canob** [reply]
Strange, I modified kuiper.yaml to enable debug (is in a persisted volume) and restarted the docker (previous post), but was not working, and is only working after I added KUIPER__BASIC__DEBUG: "true" to the env of the Docker. Shouldn't the debug be working in both cases?
I'm going to review the logs now and back to you with the conclusions.
Thanks again @ngjaying

**Comment by canob** [comment]
So I did many tests for this, and every test suggests that eKuiper HTTP Push Source is lossing events randomly.

The tests:

Event pipelines that I created for the same DNS events source:
```
FluentBit Forward Output -> Fluentd MQTT Output -> EMQX MQTT -> eKuiper MQTT Stream Source named mqtt -> eKuiper Rule with "SELECT * FROM mqtt"
FluentBit HTTP Output -> eKuiper HTTP Push Stream Source named dns -> eKuiper Rule with "SELECT * FROM dns"
FluentBit HTTP Output -> OpenObserve
FluentBit HTTP Output -> Parseable
FluentBit File Output -> TextFile
```

On every case, FluentBit send all the events perfectly, but not in the case of  eKuiper HTTP Push Stream Source, which missed several.

To compare the received events in both eKuiper Sources, I did DNS queries to this domains:
marking.me, marking.biz, and marking.xyz
![imagen](https://github.com/lf-edge/ekuiper/assets/30271927/934dbbd4-ebdd-4484-b3f9-1dcccc27f0fc)
marketing.me, marketing.biz, and marketing.xyz
![imagen](https://github.com/lf-edge/ekuiper/assets/30271927/18b7b1d7-14df-4a75-b2d8-63929d565a2a)
After I did that, I review the stream.log file (eKuiper is in debug mode):
```
root@ar09-ubuntu:/disk/ekuiper/log# cat stream.log | grep marking | grep "received message"
root@ar09-ubuntu:/disk/ekuiper/log# cat stream.log | grep marking | grep "project plan receive"
time="2023-11-01 20:05:31" level=debug msg="project plan receive &{mqtt map[qname:marking.me query_type:A source_ip:10.11.0.45 tag:dns_query timestamp:Nov  1 17:06:22] 1698869131868 map[messageid:0 topic:dns_query] {{{0 0} 0 0 {{} 0} {{} 0}} map[] map[]} {0 0} map[]}" file="operator/project_operator.go:54" rule=mqtt
time="2023-11-01 20:05:32" level=debug msg="project plan receive &{mqtt map[qname:marking.me query_type:AAAA source_ip:10.11.0.45 tag:dns_query timestamp:Nov  1 17:06:23] 1698869132863 map[messageid:0 topic:dns_query] {{{0 0} 0 0 {{} 0} {{} 0}} map[] map[]} {0 0} map[]}" file="operator/project_operator.go:54" rule=mqtt
time="2023-11-01 20:05:35" level=debug msg="project plan receive &{mqtt map[qname:marking.biz query_type:A source_ip:10.11.0.45 tag:dns_query timestamp:Nov  1 17:06:26] 1698869135863 map[messageid:0 topic:dns_query] {{{0 0} 0 0 {{} 0} {{} 0}} map[] map[]} {0 0} map[]}" file="operator/project_operator.go:54" rule=mqtt
time="2023-11-01 20:05:35" level=debug msg="project plan receive &{mqtt map[qname:marking.biz query_type:AAAA source_ip:10.11.0.45 tag:dns_query timestamp:Nov  1 17:06:26] 1698869135867 map[messageid:0 topic:dns_query] {{{0 0} 0 0 {{} 0} {{} 0}} map[] map[]} {0 0} map[]}" file="operator/project_operator.go:54" rule=mqtt
time="2023-11-01 20:05:40" level=debug msg="project plan receive &{mqtt map[qname:marking.xyz query_type:A source_ip:10.11.0.45 tag:dns_query timestamp:Nov  1 17:06:31] 1698869140856 map[messageid:0 topic:dns_query] {{{0 0} 0 0 {{} 0} {{} 0}} map[] map[]} {0 0} map[]}" file="operator/project_operator.go:54" rule=mqtt
time="2023-11-01 20:05:40" level=debug msg="project plan receive &{mqtt map[qname:marking.xyz query_type:AAAA source_ip:10.11.0.45 tag:dns_query timestamp:Nov  1 17:06:31] 1698869140857 map[messageid:0 topic:dns_query] {{{0 0} 0 0 {{} 0} {{} 0}} map[] map[]} {0 0} map[]}" file="operator/project_operator.go:54" rule=mqtt
root@ar09-ubuntu:/disk/ekuiper/log# cat stream.log | grep marketing | grep "received message"
time="2023-11-01 20:11:21" level=debug msg="httppush received message map[date:2023-11-01T20:12:11.000000Z qname:marketing.xyz query_type:AAAA source_ip:10.11.0.45 tag:dns_query timestamp:Nov  1 17:12:11]" file="httpserver/data_server.go:92" httppush_connection=0
root@ar09-ubuntu:/disk/ekuiper/log# cat stream.log | grep marketing | grep "project plan receive"
time="2023-11-01 20:11:10" level=debug msg="project plan receive &{mqtt map[qname:marketing.me query_type:A source_ip:10.11.0.45 tag:dns_query timestamp:Nov  1 17:12:01] 1698869470856 map[messageid:0 topic:dns_query] {{{0 0} 0 0 {{} 0} {{} 0}} map[] map[]} {0 0} map[]}" file="operator/project_operator.go:54" rule=mqtt
time="2023-11-01 20:11:10" level=debug msg="project plan receive &{mqtt map[qname:marketing.me query_type:AAAA source_ip:10.11.0.45 tag:dns_query timestamp:Nov  1 17:12:01] 1698869470856 map[messageid:0 topic:dns_query] {{{0 0} 0 0 {{} 0} {{} 0}} map[] map[]} {0 0} map[]}" file="operator/project_operator.go:54" rule=mqtt
time="2023-11-01 20:11:14" level=debug msg="project plan receive &{mqtt map[qname:marketing.biz query_type:A source_ip:10.11.0.45 tag:dns_query timestamp:Nov  1 17:12:05] 1698869474852 map[messageid:0 topic:dns_query] {{{0 0} 0 0 {{} 0} {{} 0}} map[] map[]} {0 0} map[]}" file="operator/project_operator.go:54" rule=mqtt
time="2023-11-01 20:11:14" level=debug msg="project plan receive &{mqtt map[qname:marketing.biz query_type:AAAA source_ip:10.11.0.45 tag:dns_query timestamp:Nov  1 17:12:05] 1698869474857 map[messageid:0 topic:dns_query] {{{0 0} 0 0 {{} 0} {{} 0}} map[] map[]} {0 0} map[]}" file="operator/project_operator.go:54" rule=mqtt
time="2023-11-01 20:11:20" level=debug msg="project plan receive &{mqtt map[qname:marketing.xyz query_type:A source_ip:10.11.0.45 tag:dns_query timestamp:Nov  1 17:12:11] 1698869480858 map[messageid:0 topic:dns_query] {{{0 0} 0 0 {{} 0} {{} 0}} map[] map[]} {0 0} map[]}" file="operator/project_operator.go:54" rule=mqtt
time="2023-11-01 20:11:21" level=debug msg="project plan receive &{mqtt map[qname:marketing.xyz query_type:AAAA source_ip:10.11.0.45 tag:dns_query timestamp:Nov  1 17:12:11] 1698869481862 map[messageid:0 topic:dns_query] {{{0 0} 0 0 {{} 0} {{} 0}} map[] map[]} {0 0} map[]}" file="operator/project_operator.go:54" rule=mqtt
```
As you can see, for the eKuiper HTTP Push Source, in the first case, domains starting with marking, I didn't receive any events (to eKuiper MQTT Source I received all the events), and for the second case, domains starting with marketing, I only received one event, instead of the six that I received with eKuiper MQTT Source.

So, it is clear that eKuiper HTTP Push is loosing events, but I don't know which other tests I can do to provide more troubleshooting information.

I'm sure there isn't a problem on FluentBit's side, simply because it is sending the same DNS events to OpenObserve and Parseable using the same output plugin, HTTP Output, without any problem.

@ngjaying, let me know If I can provide more information about the issue.

**Reply by ngjaying** [reply]
Can you search for log "receive http request"? Thanks.

**Reply by canob** [reply]
Hi @ngjaying,
The stream.log is full of this:
```
time="2023-11-01 15:45:58" level=debug msg="receive http request: /api/data/dns" file="httpserver/data_server.go:83" httppush_connection=0
time="2023-11-01 15:45:59" level=debug msg="receive http request: /api/data/dns" file="httpserver/data_server.go:83" httppush_connection=0
time="2023-11-01 15:46:00" level=debug msg="receive http request: /api/data/dns" file="httpserver/data_server.go:83" httppush_connection=0
time="2023-11-01 15:46:01" level=debug msg="receive http request: /api/data/dns" file="httpserver/data_server.go:83" httppush_connection=0
time="2023-11-01 15:46:02" level=debug msg="receive http request: /api/data/dns" file="httpserver/data_server.go:83" httppush_connection=0
time="2023-11-01 15:46:03" level=debug msg="receive http request: /api/data/dns" file="httpserver/data_server.go:83" httppush_connection=0
time="2023-11-01 15:46:04" level=debug msg="receive http request: /api/data/dns" file="httpserver/data_server.go:83" httppush_connection=0
time="2023-11-01 15:46:05" level=debug msg="receive http request: /api/data/dns" file="httpserver/data_server.go:83" httppush_connection=0
time="2023-11-01 15:46:06" level=debug msg="receive http request: /api/data/dns" file="httpserver/data_server.go:83" httppush_connection=0
```

**Reply by ngjaying** [reply]
Maybe you can just attach a log file so that we can take a look. Thanks.

**Reply by canob** [reply]
stream.log @ngjaying ?

**Reply by ngjaying** [reply]
Yes

**Reply by canob** [reply]
Here is the file
[stream.zip](https://github.com/lf-edge/ekuiper/files/13233319/stream.zip)

**Reply by ngjaying** [reply]
In the log, it seems you have several rules to consume the httppush source. Can you stop them and leave only dns_query? Also, what's your metrics like for rule dns_query?

**Reply by canob** [reply]
Stopped all the other rules.
Here are the metrics for rule dns_query:
![imagen](https://github.com/lf-edge/ekuiper/assets/30271927/0d7cfa83-90ae-4ffc-a545-ac50222a91af)

**Comment by canob** [comment]
So I'm add one additional event pipeline for the same DNS events source:
`FluentBit Forward Output -> Fluentd HTTP Output -> eKuiper HTTP Push Stream Source named dns_fluentd -> eKuiper Rule with "SELECT * FROM dns_fluentd"`
And compared to OpenObserve/Parseable/Grafana Loki, I'm loosing events every time that I used eKuiper HTTP Push Stream Source, even using FluentBit HTTP Output or Fluentd HTTP Output to send the events to eKuiper.
For example, I generated 6 events for the domain `espndeportes`, and I see that 6 events on OpenObserve/Parseable/Grafana Loki, and on stream.log file I see 1 received event from eKuiper HTTP Push Stream Source.
The 6 events on OpenObserve/Parseable/Grafana Loki:
![imagen](https://github.com/lf-edge/ekuiper/assets/30271927/349120c6-9604-46c2-a2df-228692fa88ba)
![imagen](https://github.com/lf-edge/ekuiper/assets/30271927/fe7ab5d0-b7ec-4b73-9fe4-d643de99dde6)
![imagen](https://github.com/lf-edge/ekuiper/assets/30271927/feea947a-fefe-46e2-8c0b-9b8f39af7ac2)
Only 1 received event by HTTP Push Stream Source:
```
root@ar09-ubuntu:/disk/ekuiper/log# cat stream.log | grep espndeportes | grep "received message"
time="2023-11-02 01:12:33" level=debug msg="httppush received message map[date:2023-11-02T01:13:24.000000Z qname:espndeportes.com.ar query_type:A source_ip:10.11.0.45 tag:dns_query timestamp:Nov  1 22:13:24]" file="httpserver/data_server.go:92" httppush_connection=0
root@ar09-ubuntu:/disk/ekuiper/log# cat stream.log | grep espndeportes | grep "project plan receive"
time="2023-11-02 01:12:33" level=debug msg="project plan receive &{dns map[date:2023-11-02T01:13:24.000000Z qname:espndeportes.com.ar query_type:A source_ip:10.11.0.45 tag:dns_query timestamp:Nov  1 22:13:24] 1698887553838 map[topic:$$httppush//api/data/dns] {{{0 0} 0 0 {{} 0} {{} 0}} map[] map[]} {0 0} map[]}" file="operator/project_operator.go:54" rule=dns_query
```
So, with eKuiper HTTP Push Stream Source (`FluentBit Forward Output -> Fluentd HTTP Output -> eKuiper HTTP Push Stream Source named dns_fluentd -> eKuiper Rule with "SELECT * FROM dns_fluentd"`), I'm loosing events.
And with eKuiper MQTT Stream Source (`FluentBit Forward Output -> Fluentd MQTT Output -> EMQX MQTT -> eKuiper MQTT Stream Source named mqtt -> eKuiper Rule with "SELECT * FROM mqtt"`), I'm not loosing any events.

I have no idea what is happening with eKuiper HTTP Push Stream Source, or how can I help, :(

**Reply by ngjaying** [reply]
Does this happen after closing other rules that use httppush source? In your log, there is a weird place. Sometimes the log "receive http request" does not follow up by "httppush received message". This is the problem. But I can't figure out why that would happen.

**Reply by canob** [reply]
Yes, still happening. Just tested a few seconds ago, after disabled the other rules 15 minutes ago.
I generated DNS queries to building.com as an example, and in OpenObserve/Parseable/Grafana Loki I received 8 events, but in eKuiper I received only 5 events, :(

**Reply by ngjaying** [reply]
Do you have the log for that period?

**Reply by canob** [reply]
@ngjaying , sorry, maybe what your are seeing about that sometimes "receive http request" does not follow up by "httppush received message" is because I remove all the lines with the FQDNs that contain the domain of the company where I work with a "grep -v", to not disclosure that on GitHub. I apologies for that.

**Reply by canob** [reply]
I can send you the complete file to your email if you want. Let me know.

**Reply by ngjaying** [reply]
Ah. OK. Sure you can send to my email. Can you try trigger and check the metrics or the log of "httppush received message" one by one?

**Reply by canob** [reply]
Uff, not in a simple way, because the source are live DNS server logs. Maybe what I can try is to do HTTP POSTS with JSON body with curl, "simulating" the sending of the logs that Fluentbit do, one by one.
Do you have any "recipe" to send individual logs to eKuiper HTTP Push Source with curl for example?
Let me go to sleep for a couple of hours (it is 1 o'clock in the morning here in Argentina, :-S), and I can try this when I wake up.
Thanks for your patience.

**Reply by ngjaying** [reply]
OK.  From the log, it looks like all data that arrive are handled properly. The last possibility is that some http request just not arrive at httppush source. Is it possible to diagnose from fluentbit side? If its http out is not received, are there logs/metrics?

Using curl to send may not work because we have tried and just cannot reproduce the problem. Here is an example of using curl to send data:

```shell
curl -X POST --location "http://127.0.0.1:10081/data/api" \
    -H "Content-Type: application/json" \
    -d "{
          \"id\": \"1\",
          \"name\": \"test\"
        }"
```

**Reply by canob** [reply]
Hi @ngjaying ,
From Fluentbit side, on the logs I'm only seeing HTTP 200 OK for eKuiper:
```
root@ar09-ubuntu:/disk/ekuiper/log# docker logs -n 50 fluentbit-linux 2>&1 |grep -A1 ekuiper
[2023/11/02 12:30:23] [ info] [output:http:http.23] ekuiper:10081, HTTP status=200
ok
--
[2023/11/02 12:30:24] [ info] [output:http:http.23] ekuiper:10081, HTTP status=200
ok
--
[2023/11/02 12:30:25] [ info] [output:http:http.23] ekuiper:10081, HTTP status=200
ok
--
[2023/11/02 12:30:26] [ info] [output:http:http.23] ekuiper:10081, HTTP status=200
ok
--
[2023/11/02 12:30:27] [ info] [output:http:http.23] ekuiper:10081, HTTP status=200
ok
--
[2023/11/02 12:30:28] [ info] [output:http:http.23] ekuiper:10081, HTTP status=200
ok
--
```
So I really don't know what is happening. Network issues are discarded, because all the applications are dockers inside the same docker network.
Last thing that maybe I can try is to change the send format. With FluentBit I'm using json_lines, and with Fluentd I'm using json with json_array set to false, which is the same as json_lines. The options that I have on FluentBit are msgpack (default), json, json_stream, json_lines (the one that I'm using), and gelf. Let me try changing this and I'll tell you the results.

**Reply by canob** [reply]
Tested using as output format json_stream (msgpack and json throw an error on eKuiper side about the formar), and got the same behavior.
Added debug mode to FluentBit en review the logs, but nothing really different appears:
```
root@ar09-ubuntu:/tmp/fluentbit_output# docker logs -f -n 100 fluentbit-linux 2>&1 | grep ekuiper
[2023/11/02 13:32:05] [debug] [upstream] KA connection #43 to ekuiper:10081 has been assigned (recycled)
[2023/11/02 13:32:05] [ info] [output:http:http.23] ekuiper:10081, HTTP status=200
[2023/11/02 13:32:05] [debug] [upstream] KA connection #43 to ekuiper:10081 is now available
[2023/11/02 13:32:06] [debug] [upstream] KA connection #41 to ekuiper:10081 has been assigned (recycled)
[2023/11/02 13:32:06] [ info] [output:http:http.23] ekuiper:10081, HTTP status=200
[2023/11/02 13:32:06] [debug] [upstream] KA connection #41 to ekuiper:10081 is now available
[2023/11/02 13:32:07] [debug] [upstream] KA connection #43 to ekuiper:10081 has been assigned (recycled)
[2023/11/02 13:32:07] [ info] [output:http:http.23] ekuiper:10081, HTTP status=200
[2023/11/02 13:32:07] [debug] [upstream] KA connection #43 to ekuiper:10081 is now available
```
At the end, we tried with more than one Log Collector (FluentBit and Fluentd, both using their HTTP Output option), and with more than one format (json_lines and json_stream), so I'm out of troubleshooting ideas right now, :(

**Reply by ngjaying** [reply]
I don't familiar with fluentbit. But the things I would like to check is the number: is the fluentbit output number the same the eKuiper rule metric input? Can you start eKuiper rule firstly, make sure its metrics start from 0. And then start fluentbit for a while and compare the numbers if you can't send them one by one.

**Reply by canob** [reply]
Ok, give me some time, and I'm going to change the pipeline from this:
FluentBit Syslog Input (no control of what I'm receiving) -> FluentBit HTTP Output -> eKuiper HTTP Push Stream Source
To this, for testing:
FluentBit File Input (with a fixed number of DNS events in JSON format in the file) -> FluentBit HTTP Output -> eKuiper HTTP Push Stream Source
Sounds ok for you for testing? With that, I can test many times to send the same events, or add more events to the DNS events JSON file gradually to analize the behavior.

**Reply by canob** [reply]
So...
I created a file with 100 DNS events, dns_query_100.json, in json_lines format:
```
root@ar09-ubuntu:/disk/ekuiper/output# head -n 5 /logs/dns_query_100.json
{"qname":"comm-cohort.ess.apple.com","source_ip":"10.11.21.7","timestamp":"Nov  2 10:38:05","tag":"dns_query","query_type":"A"}
{"qname":"roaming.officeapps.live.com","source_ip":"10.199.0.145","timestamp":"Nov  2 10:38:05","tag":"dns_query","query_type":"A"}
{"query_type":"A","timestamp":"Nov  2 10:38:05","tag":"dns_query","source_ip":"10.11.0.50","qname":"ntp.msn.com"}
{"query_type":"HTTPS","timestamp":"Nov  2 10:38:05","tag":"dns_query","source_ip":"10.11.0.50","qname":"ntp.msn.com"}
{"query_type":"A","timestamp":"Nov  2 10:38:05","tag":"dns_query","source_ip":"10.11.0.50","qname":"ntp.msn.com"}
```
After that, I configured these event pipelines on FluentBit:
```
FluentBit Tail Input (dns_query_100.json file) -> eKuiper HTTP Push Stream Source (json_lines format, and tested with json_stream too) -> eKuiper File Sink (dns_file)
FluentBit Tail Input (dns_query_100.json file) -> FluentBit File Output (dns_file)
```
And created a eKuiper Rule specially for this, whit a new eKuiper HTTP Push Stream Source:
```
{
  "streams": {
    "dns_file": "\n              CREATE STREAM dns_file\n              ()\n              WITH (DATASOURCE=\"/api/data/dns_file\", FORMAT=\"json\", CONF_KEY=\"default\", TYPE=\"httppush\", SHARED=\"false\", TIMESTAMP=\"timestamp\", );\n          "
  },
  "tables": {},
  "rules": {
    "dns_file": "{\"id\":\"dns_file\",\"name\":\"dns_file\",\"triggered\":true,\"sql\":\"SELECT * FROM dns_file;\",\"actions\":[{\"file\":{\"resourceId\":\"dns\",\"checkInterval\":6000,\"fileType\":\"lines\",\"hasHeader\":false,\"path\":\"/kuiper/output/dns-file.json\",\"rollingCount\":10000,\"rollingNamePattern\":\"none\",\"omitIfEmpty\":false,\"sendSingle\":true,\"format\":\"json\",\"bufferLength\":1024,\"enableCache\":false,\"runAsync\":true}}],\"options\":{\"debug\":false,\"logFilename\":\"\",\"isEventTime\":false,\"lateTolerance\":1000,\"concurrency\":1,\"bufferLength\":1024,\"sendMetaToSink\":false,\"sendError\":true,\"qos\":0,\"checkpointInterval\":300000,\"cron\":\"\",\"duration\":\"\",\"cronDatetimeRange\":null,\"restartStrategy\":{\"attempts\":0,\"delay\":1000,\"multiplier\":2,\"maxDelay\":30000,\"jitter\":0.1}}}"
  },
  "nativePlugins": {},
  "portablePlugins": {},
  "sourceConfig": {
    "httppush": "{\"default\":{}}"
  },
  "sinkConfig": {
    "file": "{\"dns\":{\"bufferLength\":1024,\"checkInterval\":600000,\"enableCache\":false,\"fileType\":\"lines\",\"format\":\"json\",\"hasHeader\":false,\"omitIfEmpty\":false,\"path\":\"/kuiper/output/dns-metrics.json\",\"rollingCount\":\"10000\",\"rollingInterval\":3600000,\"rollingNamePattern\":\"suffix\",\"runAsync\":false,\"sendSingle\":true}}"
  },
  "connectionConfig": {},
  "Service": {},
  "Schema": {},
  "uploads": {}
}
```
I stopped all the other rules on eKuiper, and started a tcpdump on port 10081, with the flag to capture the packet content.
After that, I restarted fluentbit docker container, to collect and send all the content of the dns_query_100.json file.
Reviewing the content of both output files (the output file of FluentBit and the sink file of eKuiper), I can see that the output file of FluentBit received all the events:
```
root@ar09-ubuntu:/logs# cat /tmp/fluentbit_output/dns_file | wc -l
100
root@ar09-ubuntu:/logs# head -n 3 /tmp/fluentbit_output/dns_file
dns_file: [1698948365.528531789, {"qname":"comm-cohort.ess.apple.com","query_type":"A","tag":"dns_file","timestamp":"Nov  2 10:38:05","source_ip":"10.11.21.7"}]
dns_file: [1698948365.528544902, {"qname":"roaming.officeapps.live.com","query_type":"A","tag":"dns_file","timestamp":"Nov  2 10:38:05","source_ip":"10.199.0.145"}]
dns_file: [1698948365.528554916, {"qname":"ntp.msn.com","source_ip":"10.11.0.50","tag":"dns_file","timestamp":"Nov  2 10:38:05","query_type":"A"}]


```
But the sink file of eKuiper only has the first event (without config rolling interval for the file, I "meet" the bug that I reported and you corrected, https://github.com/lf-edge/ekuiper/pull/2370, and the file was empty for minutes, so I changed the sink config to add rolling interval and a suffix rolling name pattern):
ar09-ubuntu:/disk/ekuiper/output# cat /disk/ekuiper/output/dns-file-1698950348847.json
{"date":"2023-11-02T18:39:08.554616Z","qname":"comm-cohort.ess.apple.com","query_type":"A","source_ip":"10.11.21.7","tag":"dns_file","timestamp":"Nov  2 10:38:05"}
And you can see that is consistent with the stats of the rule:
![imagen](https://github.com/lf-edge/ekuiper/assets/30271927/acc72e50-ba70-41b3-9198-c56c751bfb8c)

After that, to understand if FluentBit is not sending all the event lines to eKuiper, or if eKuiper HTTP Push Source is no "interpreting" correctly what is receiving, I review the tcpdump, and corroborated that FluentBit is sending all the events:
```
root@ar09-ubuntu:/logs# tcpdump -i any dst port 10081 -nn -A
tcpdump: data link type LINUX_SLL2
tcpdump: verbose output suppressed, use -v[v]... for full protocol decode
listening on any, link-type LINUX_SLL2 (Linux cooked v2), snapshot length 262144 bytes
17:39:57.836430 vethdc35943 P   IP 172.18.0.6.60068 > 172.18.0.30.10081: Flags [S], seq 1254875277, win 64240, options [mss 1460,sackOK,TS val 4004168068 ecr 0,nop,wscale 7], length 0
E..<.X@.@.4...........'aJ...........Xw.........
............
17:39:57.836587 veth01df584 Out IP 172.18.0.6.60068 > 172.18.0.30.10081: Flags [S], seq 1254875277, win 64240, options [mss 1460,sackOK,TS val 4004168068 ecr 0,nop,wscale 7], length 0
E..<.X@.@.4...........'aJ...........Xw.........
............
17:39:57.836635 vethdc35943 P   IP 172.18.0.6.60068 > 172.18.0.30.10081: Flags [.], ack 2373810485, win 502, options [nop,nop,TS val 4004168068 ecr 4268930295], length 0
E..4.Y@.@.4"..........'aJ....}y5....Xo.....
.....r..
17:39:57.836640 veth01df584 Out IP 172.18.0.6.60068 > 172.18.0.30.10081: Flags [.], ack 1, win 502, options [nop,nop,TS val 4004168068 ecr 4268930295], length 0
E..4.Y@.@.4"..........'aJ....}y5....Xo.....
.....r..
17:39:57.837186 vethdc35943 P   IP 172.18.0.6.60068 > 172.18.0.30.10081: Flags [P.], seq 0:136, ack 1, win 502, options [nop,nop,TS val 4004168069 ecr 4268930295], length 136
E....Z@.@.3...........'aJ....}y5....X......
.....r..POST /api/data/dns_file HTTP/1.1
Host: ekuiper:10081
Content-Length: 16036
Content-Type: application/json
User-Agent: Fluent-Bit


17:39:57.837202 veth01df584 Out IP 172.18.0.6.60068 > 172.18.0.30.10081: Flags [P.], seq 0:136, ack 1, win 502, options [nop,nop,TS val 4004168069 ecr 4268930295], length 136
E....Z@.@.3...........'aJ....}y5....X......
.....r..POST /api/data/dns_file HTTP/1.1
Host: ekuiper:10081
Content-Length: 16036
Content-Type: application/json
User-Agent: Fluent-Bit


17:39:57.837926 vethdc35943 P   IP 172.18.0.6.60068 > 172.18.0.30.10081: Flags [P.], seq 136:7376, ack 1, win 502, options [nop,nop,TS val 4004168070 ecr 4268930296], length 7240
E..|.[@.@.............'aJ....}y5....t......
.....r..{"date":"2023-11-02T17:39:57.582689Z","timestamp":"Nov  2 10:38:05","query_type":"A","qname":"comm-cohort.ess.apple.com","source_ip":"10.11.21.7","tag":"dns_file"}{"date":"2023-11-02T17:39:57.582717Z","timestamp":"Nov  2 10:38:05","query_type":"A","qname":"roaming.officeapps.live.com","source_ip":"10.199.0.145","tag":"dns_file"}{"date":"2023-11-02T17:39:57.582726Z","timestamp":"Nov  2 10:38:05","query_type":"A","qname":"ntp.msn.com","source_ip":"10.11.0.50","tag":"dns_file"}{"date":"2023-11-02T17:39:57.582733Z","timestamp":"Nov  2 10:38:05","query_type":"HTTPS","qname":"ntp.msn.com","source_ip":"10.11.0.50","tag":"dns_file"}{"date":"2023-11-02T17:39:57.582739Z","timestamp":"Nov  2 10:38:05","query_type":"A","qname":"ntp.msn.com","source_ip":"10.11.0.50","tag":"dns_file"}{"date":"2023-11-02T17:39:57.582746Z","timestamp":"Nov  2 10:38:06","query_type":"A","qname":"img-s-msn-com.akamaized.net","source_ip":"10.11.0.50","tag":"dns_file"}{"date":"2023-11-02T17:39:57.582754Z","timestamp":"Nov  2 10:38:06","query_type":"HTTPS","qname":"img-s-msn-com.akamaized.net","source_ip":"10.11.0.50","tag":"dns_file"}{"date":"2023-11-02T17:39:57.582760Z","timestamp":"Nov  2 10:38:06","query_type":"A","qname":"sb.scorecardresearch.com","source_ip":"10.11.0.50","tag":"dns_file"}{"date":"2023-11-02T17:39:57.582768Z","timestamp":"Nov  2 10:38:06","query_type":"HTTPS","qname":"sb.scorecardresearch.com","source_ip":"10.11.0.50","tag":"dns_file"}{"date":"2023-11-02T17:39:57.582775Z","timestamp":"Nov  2 10:38:06","query_type":"A","qname":"www.facebook.com","source_ip":"10.199.0.181","tag":"dns_file"}{"date":"2023-11-02T17:39:57.582782Z","timestamp":"Nov  2 10:38:06","query_type":"A","qname":"th.bing.com","source_ip":"10.11.0.50","tag":"dns_file"}{"date":"2023-11-02T17:39:57.582792Z","timestamp":"Nov  2 10:38:06","query_type":"HTTPS","qname":"th.bing.com","source_ip":"10.11.0.50","tag":"dns_file"}{"date":"2023-11-02T17:39:57.582798Z","timestamp":"Nov  2 10:38:06","query_type":"A","qname":"www.bing.com","source_ip":"10.11.0.50","tag":"dns_file"}{"date":"2023-11-02T17:39:57.582805Z","timestamp":"Nov  2 10:38:06","query_type":"HTTPS","qname":"www.bing.com","source_ip":"10.11.0.50","tag":"dns_file"}{"date":"2023-11-02T17:39:57.582811Z","timestamp":"Nov  2 10:38:06","query_type":"A","qname":"static.xx.fbcdn.net","source_ip":"10.199.0.181","tag":"dns_file"}{"date":"2023-11-02T17:39:57.582819Z","timestamp":"Nov  2 10:38:06","query_type":"A","qname":"api.msn.com","source_ip":"10.11.0.50","tag":"dns_file"}{"date":"2023-11-02T17:39:57.582826Z","timestamp":"Nov  2 10:38:06","query_type":"HTTPS","qname":"api.msn.com","source_ip":"10.11.0.50","tag":"dns_file"}{"date":"2023-11-02T17:39:57.582833Z","timestamp":"Nov  2 10:38:06","query_type":"A","qname":"www.facebook.com","source_ip":"10.199.0.181","tag":"dns_file"}{"date":"2023-11-02T17:39:57.582839Z","timestamp":"Nov  2 10:38:06","query_type":"A","qname":"scontent.xx.fbcdn.net","source_ip":"10.199.0.181","tag":"dns_file"}{"date":"2023-11-02T17:39:57.582845Z","timestamp":"Nov  2 10:38:06","query_type":"A","qname":"c.msn.com","source_ip":"10.11.0.50","tag":"dns_file"}{"date":"2023-11-02T17:39:57.582852Z","timestamp":"Nov  2 10:38:06","query_type":"A","qname":"c.bing.com","source_ip":"10.11.0.50","tag":"dns_file"}{"date":"2023-11-02T17:39:57.582859Z","timestamp":"Nov  2 10:38:06","query_type":"HTTPS","qname":"c.msn.com","source_ip":"10.11.0.50","tag":"dns_file"}{"date":"2023-11-02T17:39:57.582866Z","timestamp":"Nov  2 10:38:06","query_type":"HTTPS","qname":"c.bing.com","source_ip":"10.11.0.50","tag":"dns_file"}{"date":"2023-11-02T17:39:57.582872Z","timestamp":"Nov  2 10:38:06","query_type":"A","qname":"assets.msn.com","source_ip":"10.11.0.50","tag":"dns_file"}{"date":"2023-11-02T17:39:57.582879Z","timestamp":"Nov  2 10:38:06","query_type":"HTTPS","qname":"assets.msn.com","source_ip":"10.11.0.50","tag":"dns_file"}{"date":"2023-11-02T17:39:57.582885Z","timestamp":"Nov  2 10:38:06","query_type":"A","qname":"star-mini.c10r.facebook.com","source_ip":"10.199.0.181","tag":"dns_file"}{"date":"2023-11-02T17:39:57.582892Z","timestamp":"Nov  2 10:38:06","query_type":"A","qname":"holdingcbs.lightning.force.com","source_ip":"10.199.0.152","tag":"dns_file"}{"date":"2023-11-02T17:39:57.582899Z","timestamp":"Nov  2 10:38:06","query_type":"A","qname":"threat.api.mcafee.com","source_ip":"10.199.0.37","tag":"dns_file"}{"date":"2023-11-02T17:39:57.582905Z","timestamp":"Nov  2 10:38:06","query_type":"A","qname":"na163-ia5.ia5.r.force.com","source_ip":"10.199.0.152","tag":"dns_file"}{"date":"2023-11-02T17:39:57.582912Z","timestamp":"Nov  2 10:38:06","query_type":"AAAA","qname":"na163-ia5.ia5.r.force.com","source_ip":"10.199.0.152","tag":"dns_file"}{"date":"2023-11-02T17:39:57.582919Z","timestamp":"Nov  2 10:38:06","query_type":"A","qname":"www.facebook.com","source_ip":"10.199.0.181","tag":"dns_file"}{"date":"2023-11-02T17:39:57.582926Z","timestamp":"Nov  2 10:38:06","query_type":"A","qname":"star-mini.c10r.facebook.com","source_ip":"10.199.0.181","tag":"dns_file"}{"date":"2023-11-02T17:39:57.582935Z","timestamp":"Nov  2 10:38:07","query_type":"A","qname":"odc.officeapps.live.com","source_ip":"10.199.0.145","tag":"dns_file"}{"date":"2023-11-02T17:39:57.582942Z","timestamp":"Nov  2 10:38:07","query_type":"A","qname":"cdn.odc.officeapps.live.com","source_ip":"10.199.0.145","tag":"dns_file"}{"date":"2023-11-02T17:39:57.582951Z","timestamp":"Nov  2 10:38:07","query_type":"A","qname":"outlook.office365.com","source_ip":"10.199.0.154","tag":"dns_file"}{"date":"2023-11-02T17:39:57.582957Z","timestamp":"Nov  2 10:38:07","query_type":"A","qname":"messaging.engagement.office.com","source_ip":"10.199.0.163","tag":"dns_file"}{"date":"2023-11-02T17:39:57.582968Z","timestamp":"Nov  2 10:38:07","query_type":"A","qname":"teams.events.data.microsoft.com","source_ip":"10.199.0.181","tag":"dns_file"}{"date":"2023-11-02T17:39:57.582975Z","timestamp":"Nov  2 10:38:07","query_type":"A","qname":"edge.microsoft.com","source_ip":"10.11.21.25","tag":"dns_file"}{"date":"2023-11-02T17:39:57.582982Z","timestamp":"Nov  2 10:38:07","query_type":"HTTPS","qname":"edge.microsoft.com","source_ip":"10.11.21.25","tag":"dns_file"}{"date":"2023-11-02T17:39:57.582992Z","timestamp":"Nov  2 10:38:08","query_type":"A","qname":"functional.events.data.microsoft.com","source_ip":"10.11.0.50","tag":"dns_file"}{"date":"2023-11-02T17:39:57.583041Z","timestamp":"Nov  2 10:38:08","query_type":"HTTPS","qname":"functional.events.data.microsoft.com","source_ip":"10.11.0.50","tag":"dns_file"}{"date":"2023-11-02T17:39:57.583052Z","timestamp":"Nov  2 10:38:08","query_type":"A","qname":"www.bing.com","source_ip":"10.199.0.79","tag":"dns_file"}{"date":"2023-11-02T17:39:57.583059Z","timestamp":"Nov  2 10:38:08","query_type":"A","qname":"v10.events.data.microsoft.com","source_ip":"10.199.0.63","tag":"dns_file"}{"date":"2023-11-02T17:39:57.583067Z","timestamp":"Nov  2 10:38:08","query_type":"A","qname":"officeclient.microsoft.com","source_ip":"10.11.2.40","tag":"dns_file"}{"date":"2023-11-02T17:39:57.583075Z","timestamp":"Nov  2 10:38:08","query_type":"A","qname":"example.com","source_ip":"10.199.0.144","tag":"dns_file"}{"date":"2023-11-02T17:39:57.583081Z","timestamp":"Nov  2 10:
17:39:57.837939 veth01df584 Out IP 172.18.0.6.60068 > 172.18.0.30.10081: Flags [P.], seq 136:7376, ack 1, win 502, options [nop,nop,TS val 4004168070 ecr 4268930296], length 7240
E..|.[@.@.............'aJ....}y5....t......
.....r..{"date":"2023-11-02T17:39:57.582689Z","timestamp":"Nov  2 10:38:05","query_type":"A","qname":"comm-cohort.ess.apple.com","source_ip":"10.11.21.7","tag":"dns_file"}{"date":"2023-11-02T17:39:57.582717Z","timestamp":"Nov  2 10:38:05","query_type":"A","qname":"roaming.officeapps.live.com","source_ip":"10.199.0.145","tag":"dns_file"}{"date":"2023-11-02T17:39:57.582726Z","timestamp":"Nov  2 10:38:05","query_type":"A","qname":"ntp.msn.com","source_ip":"10.11.0.50","tag":"dns_file"}{"date":"2023-11-02T17:39:57.582733Z","timestamp":"Nov  2 10:38:05","query_type":"HTTPS","qname":"ntp.msn.com","source_ip":"10.11.0.50","tag":"dns_file"}{"date":"2023-11-02T17:39:57.582739Z","timestamp":"Nov  2 10:38:05","query_type":"A","qname":"ntp.msn.com","source_ip":"10.11.0.50","tag":"dns_file"}{"date":"2023-11-02T17:39:57.582746Z","timestamp":"Nov  2 10:38:06","query_type":"A","qname":"img-s-msn-com.akamaized.net","source_ip":"10.11.0.50","tag":"dns_file"}{"date":"2023-11-02T17:39:57.582754Z","timestamp":"Nov  2 10:38:06","query_type":"HTTPS","qname":"img-s-msn-com.akamaized.net","source_ip":"10.11.0.50","tag":"dns_file"}{"date":"2023-11-02T17:39:57.582760Z","timestamp":"Nov  2 10:38:06","query_type":"A","qname":"sb.scorecardresearch.com","source_ip":"10.11.0.50","tag":"dns_file"}{"date":"2023-11-02T17:39:57.582768Z","timestamp":"Nov  2 10:38:06","query_type":"HTTPS","qname":"sb.scorecardresearch.com","source_ip":"10.11.0.50","tag":"dns_file"}{"date":"2023-11-02T17:39:57.582775Z","timestamp":"Nov  2 10:38:06","query_type":"A","qname":"www.facebook.com","source_ip":"10.199.0.181","tag":"dns_file"}{"date":"2023-11-02T17:39:57.582782Z","timestamp":"Nov  2 10:38:06","query_type":"A","qname":"th.bing.com","source_ip":"10.11.0.50","tag":"dns_file"}{"date":"2023-11-02T17:39:57.582792Z","timestamp":"Nov  2 10:38:06","query_type":"HTTPS","qname":"th.bing.com","source_ip":"10.11.0.50","tag":"dns_file"}{"date":"2023-11-02T17:39:57.582798Z","timestamp":"Nov  2 10:38:06","query_type":"A","qname":"www.bing.com","source_ip":"10.11.0.50","tag":"dns_file"}{"date":"2023-11-02T17:39:57.582805Z","timestamp":"Nov  2 10:38:06","query_type":"HTTPS","qname":"www.bing.com","source_ip":"10.11.0.50","tag":"dns_file"}{"date":"2023-11-02T17:39:57.582811Z","timestamp":"Nov  2 10:38:06","query_type":"A","qname":"static.xx.fbcdn.net","source_ip":"10.199.0.181","tag":"dns_file"}{"date":"2023-11-02T17:39:57.582819Z","timestamp":"Nov  2 10:38:06","query_type":"A","qname":"api.msn.com","source_ip":"10.11.0.50","tag":"dns_file"}{"date":"2023-11-02T17:39:57.582826Z","timestamp":"Nov  2 10:38:06","query_type":"HTTPS","qname":"api.msn.com","source_ip":"10.11.0.50","tag":"dns_file"}{"date":"2023-11-02T17:39:57.582833Z","timestamp":"Nov  2 10:38:06","query_type":"A","qname":"www.facebook.com","source_ip":"10.199.0.181","tag":"dns_file"}{"date":"2023-11-02T17:39:57.582839Z","timestamp":"Nov  2 10:38:06","query_type":"A","qname":"scontent.xx.fbcdn.net","source_ip":"10.199.0.181","tag":"dns_file"}{"date":"2023-11-02T17:39:57.582845Z","timestamp":"Nov  2 10:38:06","query_type":"A","qname":"c.msn.com","source_ip":"10.11.0.50","tag":"dns_file"}{"date":"2023-11-02T17:39:57.582852Z","timestamp":"Nov  2 10:38:06","query_type":"A","qname":"c.bing.com","source_ip":"10.11.0.50","tag":"dns_file"}{"date":"2023-11-02T17:39:57.582859Z","timestamp":"Nov  2 10:38:06","query_type":"HTTPS","qname":"c.msn.com","source_ip":"10.11.0.50","tag":"dns_file"}{"date":"2023-11-02T17:39:57.582866Z","timestamp":"Nov  2 10:38:06","query_type":"HTTPS","qname":"c.bing.com","source_ip":"10.11.0.50","tag":"dns_file"}{"date":"2023-11-02T17:39:57.582872Z","timestamp":"Nov  2 10:38:06","query_type":"A","qname":"assets.msn.com","source_ip":"10.11.0.50","tag":"dns_file"}{"date":"2023-11-02T17:39:57.582879Z","timestamp":"Nov  2 10:38:06","query_type":"HTTPS","qname":"assets.msn.com","source_ip":"10.11.0.50","tag":"dns_file"}{"date":"2023-11-02T17:39:57.582885Z","timestamp":"Nov  2 10:38:06","query_type":"A","qname":"star-mini.c10r.facebook.com","source_ip":"10.199.0.181","tag":"dns_file"}{"date":"2023-11-02T17:39:57.582892Z","timestamp":"Nov  2 10:38:06","query_type":"A","qname":"holdingcbs.lightning.force.com","source_ip":"10.199.0.152","tag":"dns_file"}{"date":"2023-11-02T17:39:57.582899Z","timestamp":"Nov  2 10:38:06","query_type":"A","qname":"threat.api.mcafee.com","source_ip":"10.199.0.37","tag":"dns_file"}{"date":"2023-11-02T17:39:57.582905Z","timestamp":"Nov  2 10:38:06","query_type":"A","qname":"na163-ia5.ia5.r.force.com","source_ip":"10.199.0.152","tag":"dns_file"}{"date":"2023-11-02T17:39:57.582912Z","timestamp":"Nov  2 10:38:06","query_type":"AAAA","qname":"na163-ia5.ia5.r.force.com","source_ip":"10.199.0.152","tag":"dns_file"}{"date":"2023-11-02T17:39:57.582919Z","timestamp":"Nov  2 10:38:06","query_type":"A","qname":"www.facebook.com","source_ip":"10.199.0.181","tag":"dns_file"}{"date":"2023-11-02T17:39:57.582926Z","timestamp":"Nov  2 10:38:06","query_type":"A","qname":"star-mini.c10r.facebook.com","source_ip":"10.199.0.181","tag":"dns_file"}{"date":"2023-11-02T17:39:57.582935Z","timestamp":"Nov  2 10:38:07","query_type":"A","qname":"odc.officeapps.live.com","source_ip":"10.199.0.145","tag":"dns_file"}{"date":"2023-11-02T17:39:57.582942Z","timestamp":"Nov  2 10:38:07","query_type":"A","qname":"cdn.odc.officeapps.live.com","source_ip":"10.199.0.145","tag":"dns_file"}{"date":"2023-11-02T17:39:57.582951Z","timestamp":"Nov  2 10:38:07","query_type":"A","qname":"outlook.office365.com","source_ip":"10.199.0.154","tag":"dns_file"}{"date":"2023-11-02T17:39:57.582957Z","timestamp":"Nov  2 10:38:07","query_type":"A","qname":"messaging.engagement.office.com","source_ip":"10.199.0.163","tag":"dns_file"}{"date":"2023-11-02T17:39:57.582968Z","timestamp":"Nov  2 10:38:07","query_type":"A","qname":"teams.events.data.microsoft.com","source_ip":"10.199.0.181","tag":"dns_file"}{"date":"2023-11-02T17:39:57.582975Z","timestamp":"Nov  2 10:38:07","query_type":"A","qname":"edge.microsoft.com","source_ip":"10.11.21.25","tag":"dns_file"}{"date":"2023-11-02T17:39:57.582982Z","timestamp":"Nov  2 10:38:07","query_type":"HTTPS","qname":"edge.microsoft.com","source_ip":"10.11.21.25","tag":"dns_file"}{"date":"2023-11-02T17:39:57.582992Z","timestamp":"Nov  2 10:38:08","query_type":"A","qname":"functional.events.data.microsoft.com","source_ip":"10.11.0.50","tag":"dns_file"}{"date":"2023-11-02T17:39:57.583041Z","timestamp":"Nov  2 10:38:08","query_type":"HTTPS","qname":"functional.events.data.microsoft.com","source_ip":"10.11.0.50","tag":"dns_file"}{"date":"2023-11-02T17:39:57.583052Z","timestamp":"Nov  2 10:38:08","query_type":"A","qname":"www.bing.com","source_ip":"10.199.0.79","tag":"dns_file"}{"date":"2023-11-02T17:39:57.583059Z","timestamp":"Nov  2 10:38:08","query_type":"A","qname":"v10.events.data.microsoft.com","source_ip":"10.199.0.63","tag":"dns_file"}{"date":"2023-11-02T17:39:57.583067Z","timestamp":"Nov  2 10:38:08","query_type":"A","qname":"officeclient.microsoft.com","source_ip":"10.11.2.40","tag":"dns_file"}{"date":"2023-11-02T17:39:57.583075Z","timestamp":"Nov  2 10:38:08","query_type":"A","qname":"example.com","source_ip":"10.199.0.144","tag":"dns_file"}{"date":"2023-11-02T17:39:57.583081Z","timestamp":"Nov  2 10:
17:39:57.838196 vethdc35943 P   IP 172.18.0.6.60068 > 172.18.0.30.10081: Flags [P.], seq 7376:14616, ack 1, win 502, options [nop,nop,TS val 4004168070 ecr 4268930296], length 7240
E..|.`@.@.............'aJ..^.}y5....t......
.....r..38:08","query_type":"AAAA","qname":"example.com","source_ip":"10.199.0.144","tag":"dns_file"}{"date":"2023-11-02T17:39:57.583088Z","timestamp":"Nov  2 10:38:08","query_type":"A","qname":"github.com","source_ip":"10.199.0.144","tag":"dns_file"}{"date":"2023-11-02T17:39:57.583095Z","timestamp":"Nov  2 10:38:08","query_type":"AAAA","qname":"github.com","source_ip":"10.199.0.144","tag":"dns_file"}{"date":"2023-11-02T17:39:57.583103Z","timestamp":"Nov  2 10:38:09","query_type":"A","qname":"redacted2.com","source_ip":"10.199.0.166","tag":"dns_file"}{"date":"2023-11-02T17:39:57.583109Z","timestamp":"Nov  2 10:38:09","query_type":"A","qname":"self.events.data.microsoft.com","source_ip":"10.11.2.40","tag":"dns_file"}{"date":"2023-11-02T17:39:57.583117Z","timestamp":"Nov  2 10:38:09","query_type":"A","qname":"storecatalogrevocation.storequality.microsoft.com","source_ip":"10.11.2.34","tag":"dns_file"}{"date":"2023-11-02T17:39:57.583123Z","timestamp":"Nov  2 10:38:10","query_type":"A","qname":"redacted3.com","source_ip":"10.11.21.46","tag":"dns_file"}{"date":"2023-11-02T17:39:57.583130Z","timestamp":"Nov  2 10:38:10","query_type":"SRV","qname":"_ldap._tcp.NeoArgentina._sites.redacted","source_ip":"10.199.0.166","tag":"dns_file"}{"date":"2023-11-02T17:39:57.583138Z","timestamp":"Nov  2 10:38:10","query_type":"A","qname":"www.google.com","source_ip":"10.199.0.166","tag":"dns_file"}{"date":"2023-11-02T17:39:57.583144Z","timestamp":"Nov  2 10:38:11","query_type":"A","qname":"presence.teams.microsoft.com","source_ip":"10.199.0.83","tag":"dns_file"}{"date":"2023-11-02T17:39:57.583150Z","timestamp":"Nov  2 10:38:11","query_type":"A","qname":"pi.hole","source_ip":"127.0.0.1","tag":"dns_file"}{"date":"2023-11-02T17:39:57.583157Z","timestamp":"Nov  2 10:38:11","query_type":"A","qname":"raw.githubusercontent.com","source_ip":"10.199.0.144","tag":"dns_file"}{"date":"2023-11-02T17:39:57.583163Z","timestamp":"Nov  2 10:38:11","query_type":"AAAA","qname":"raw.githubusercontent.com","source_ip":"10.199.0.144","tag":"dns_file"}{"date":"2023-11-02T17:39:57.583171Z","timestamp":"Nov  2 10:38:11","query_type":"A","qname":"presence.teams.microsoft.com","source_ip":"10.11.2.27","tag":"dns_file"}{"date":"2023-11-02T17:39:57.583177Z","timestamp":"Nov  2 10:38:11","query_type":"HTTPS","qname":"presence.teams.microsoft.com","source_ip":"10.11.2.27","tag":"dns_file"}{"date":"2023-11-02T17:39:57.583184Z","timestamp":"Nov  2 10:38:11","query_type":"A","qname":"officeclient.microsoft.com","source_ip":"10.11.6.15","tag":"dns_file"}{"date":"2023-11-02T17:39:57.583189Z","timestamp":"Nov  2 10:38:11","query_type":"A","qname":"mesu.apple.com","source_ip":"10.11.21.7","tag":"dns_file"}{"date":"2023-11-02T17:39:57.583209Z","timestamp":"Nov  2 10:38:11","query_type":"HTTPS","qname":"mesu.apple.com","source_ip":"10.11.21.7","tag":"dns_file"}{"date":"2023-11-02T17:39:57.583217Z","timestamp":"Nov  2 10:38:11","query_type":"SVCB","qname":"_dns.resolver.arpa","source_ip":"10.11.21.7","tag":"dns_file"}{"date":"2023-11-02T17:39:57.583223Z","timestamp":"Nov  2 10:38:11","query_type":"HTTPS","qname":"captive.apple.com","source_ip":"10.11.21.7","tag":"dns_file"}{"date":"2023-11-02T17:39:57.583231Z","timestamp":"Nov  2 10:38:11","query_type":"A","qname":"captive.apple.com","source_ip":"10.11.21.7","tag":"dns_file"}{"date":"2023-11-02T17:39:57.583238Z","timestamp":"Nov  2 10:38:11","query_type":"HTTPS","qname":"dns.google","source_ip":"10.11.21.7","tag":"dns_file"}{"date":"2023-11-02T17:39:57.583245Z","timestamp":"Nov  2 10:38:11","query_type":"A","qname":"dns.google","source_ip":"10.11.21.7","tag":"dns_file"}{"date":"2023-11-02T17:39:57.583251Z","timestamp":"Nov  2 10:38:11","query_type":"HTTPS","qname":"mesu.g.aaplimg.com","source_ip":"10.11.21.7","tag":"dns_file"}{"date":"2023-11-02T17:39:57.583258Z","timestamp":"Nov  2 10:38:11","query_type":"HTTPS","qname":"captive.g.aaplimg.com","source_ip":"10.11.21.7","tag":"dns_file"}{"date":"2023-11-02T17:39:57.583265Z","timestamp":"Nov  2 10:38:11","query_type":"A","qname":"www.google.com.ar","source_ip":"10.11.21.7","tag":"dns_file"}{"date":"2023-11-02T17:39:57.583271Z","timestamp":"Nov  2 10:38:11","query_type":"HTTPS","qname":"www.google.com.ar","source_ip":"10.11.21.7","tag":"dns_file"}{"date":"2023-11-02T17:39:57.583278Z","timestamp":"Nov  2 10:38:12","query_type":"SVCB","qname":"_dns.resolver.arpa","source_ip":"10.11.21.7","tag":"dns_file"}{"date":"2023-11-02T17:39:57.583285Z","timestamp":"Nov  2 10:38:12","query_type":"HTTPS","qname":"gsp85-ssl.ls.apple.com","source_ip":"10.11.21.7","tag":"dns_file"}{"date":"2023-11-02T17:39:57.583293Z","timestamp":"Nov  2 10:38:12","query_type":"A","qname":"gsp85-ssl.ls.apple.com","source_ip":"10.11.21.7","tag":"dns_file"}{"date":"2023-11-02T17:39:57.583300Z","timestamp":"Nov  2 10:38:12","query_type":"A","qname":"signaler-pa.clients6.google.com","source_ip":"10.11.2.40","tag":"dns_file"}{"date":"2023-11-02T17:39:57.583307Z","timestamp":"Nov  2 10:38:12","query_type":"HTTPS","qname":"signaler-pa.clients6.google.com","source_ip":"10.11.2.40","tag":"dns_file"}{"date":"2023-11-02T17:39:57.583315Z","timestamp":"Nov  2 10:38:12","query_type":"HTTPS","qname":"gateway.icloud.com","source_ip":"10.11.21.7","tag":"dns_file"}{"date":"2023-11-02T17:39:57.583322Z","timestamp":"Nov  2 10:38:12","query_type":"A","qname":"gateway.icloud.com","source_ip":"10.11.21.7","tag":"dns_file"}{"date":"2023-11-02T17:39:57.583329Z","timestamp":"Nov  2 10:38:12","query_type":"HTTPS","qname":"lcdn-locator.apple.com","source_ip":"10.11.21.7","tag":"dns_file"}{"date":"2023-11-02T17:39:57.583336Z","timestamp":"Nov  2 10:38:12","query_type":"A","qname":"lcdn-locator.apple.com","source_ip":"10.11.21.7","tag":"dns_file"}{"date":"2023-11-02T17:39:57.583343Z","timestamp":"Nov  2 10:38:12","query_type":"HTTPS","qname":"gsp85-ssl.ls2-apple.com.akadns.net","source_ip":"10.11.21.7","tag":"dns_file"}{"date":"2023-11-02T17:39:57.583349Z","timestamp":"Nov  2 10:38:12","query_type":"A","qname":"www.google.com","source_ip":"10.11.21.7","tag":"dns_file"}{"date":"2023-11-02T17:39:57.583356Z","timestamp":"Nov  2 10:38:12","query_type":"HTTPS","qname":"gateway.fe.apple-dns.net","source_ip":"10.11.21.7","tag":"dns_file"}{"date":"2023-11-02T17:39:57.583363Z","timestamp":"Nov  2 10:38:12","query_type":"A","qname":"outlook.office365.com","source_ip":"10.199.0.37","tag":"dns_file"}{"date":"2023-11-02T17:39:57.583370Z","timestamp":"Nov  2 10:38:12","query_type":"A","qname":"ocws.officeapps.live.com","source_ip":"10.199.0.37","tag":"dns_file"}{"date":"2023-11-02T17:39:57.583377Z","timestamp":"Nov  2 10:38:12","query_type":"AAAA","qname":"redacted.com","source_ip":"10.11.2.27","tag":"dns_file"}{"date":"2023-11-02T17:39:57.583384Z","timestamp":"Nov  2 10:38:12","query_type":"A","qname":"graph.microsoft.com","source_ip":"10.199.0.37","tag":"dns_file"}{"date":"2023-11-02T17:39:57.583390Z","timestamp":"Nov  2 10:38:12","query_type":"A","qname":"www.bing.com","source_ip":"10.11.21.6","tag":"dns_file"}{"date":"2023-11-02T17:39:57.583398Z","timestamp":"Nov  2 10:38:12","query_type":"HTTPS","qname":"www.bing.com","source_ip":"10.11.21.6","tag":"dns_file"}{"date":"2023-11-02T17:39:57.583405Z","timestamp":"Nov  2 10:3
17:39:57.838203 veth01df584 Out IP 172.18.0.6.60068 > 172.18.0.30.10081: Flags [P.], seq 7376:14616, ack 1, win 502, options [nop,nop,TS val 4004168070 ecr 4268930296], length 7240
E..|.`@.@.............'aJ..^.}y5....t......
.....r..38:08","query_type":"AAAA","qname":"example.com","source_ip":"10.199.0.144","tag":"dns_file"}{"date":"2023-11-02T17:39:57.583088Z","timestamp":"Nov  2 10:38:08","query_type":"A","qname":"github.com","source_ip":"10.199.0.144","tag":"dns_file"}{"date":"2023-11-02T17:39:57.583095Z","timestamp":"Nov  2 10:38:08","query_type":"AAAA","qname":"github.com","source_ip":"10.199.0.144","tag":"dns_file"}{"date":"2023-11-02T17:39:57.583103Z","timestamp":"Nov  2 10:38:09","query_type":"A","qname":"redacted2.com","source_ip":"10.199.0.166","tag":"dns_file"}{"date":"2023-11-02T17:39:57.583109Z","timestamp":"Nov  2 10:38:09","query_type":"A","qname":"self.events.data.microsoft.com","source_ip":"10.11.2.40","tag":"dns_file"}{"date":"2023-11-02T17:39:57.583117Z","timestamp":"Nov  2 10:38:09","query_type":"A","qname":"storecatalogrevocation.storequality.microsoft.com","source_ip":"10.11.2.34","tag":"dns_file"}{"date":"2023-11-02T17:39:57.583123Z","timestamp":"Nov  2 10:38:10","query_type":"A","qname":"redacted3.com","source_ip":"10.11.21.46","tag":"dns_file"}{"date":"2023-11-02T17:39:57.583130Z","timestamp":"Nov  2 10:38:10","query_type":"SRV","qname":"_ldap._tcp.NeoArgentina._sites.redacted","source_ip":"10.199.0.166","tag":"dns_file"}{"date":"2023-11-02T17:39:57.583138Z","timestamp":"Nov  2 10:38:10","query_type":"A","qname":"www.google.com","source_ip":"10.199.0.166","tag":"dns_file"}{"date":"2023-11-02T17:39:57.583144Z","timestamp":"Nov  2 10:38:11","query_type":"A","qname":"presence.teams.microsoft.com","source_ip":"10.199.0.83","tag":"dns_file"}{"date":"2023-11-02T17:39:57.583150Z","timestamp":"Nov  2 10:38:11","query_type":"A","qname":"pi.hole","source_ip":"127.0.0.1","tag":"dns_file"}{"date":"2023-11-02T17:39:57.583157Z","timestamp":"Nov  2 10:38:11","query_type":"A","qname":"raw.githubusercontent.com","source_ip":"10.199.0.144","tag":"dns_file"}{"date":"2023-11-02T17:39:57.583163Z","timestamp":"Nov  2 10:38:11","query_type":"AAAA","qname":"raw.githubusercontent.com","source_ip":"10.199.0.144","tag":"dns_file"}{"date":"2023-11-02T17:39:57.583171Z","timestamp":"Nov  2 10:38:11","query_type":"A","qname":"presence.teams.microsoft.com","source_ip":"10.11.2.27","tag":"dns_file"}{"date":"2023-11-02T17:39:57.583177Z","timestamp":"Nov  2 10:38:11","query_type":"HTTPS","qname":"presence.teams.microsoft.com","source_ip":"10.11.2.27","tag":"dns_file"}{"date":"2023-11-02T17:39:57.583184Z","timestamp":"Nov  2 10:38:11","query_type":"A","qname":"officeclient.microsoft.com","source_ip":"10.11.6.15","tag":"dns_file"}{"date":"2023-11-02T17:39:57.583189Z","timestamp":"Nov  2 10:38:11","query_type":"A","qname":"mesu.apple.com","source_ip":"10.11.21.7","tag":"dns_file"}{"date":"2023-11-02T17:39:57.583209Z","timestamp":"Nov  2 10:38:11","query_type":"HTTPS","qname":"mesu.apple.com","source_ip":"10.11.21.7","tag":"dns_file"}{"date":"2023-11-02T17:39:57.583217Z","timestamp":"Nov  2 10:38:11","query_type":"SVCB","qname":"_dns.resolver.arpa","source_ip":"10.11.21.7","tag":"dns_file"}{"date":"2023-11-02T17:39:57.583223Z","timestamp":"Nov  2 10:38:11","query_type":"HTTPS","qname":"captive.apple.com","source_ip":"10.11.21.7","tag":"dns_file"}{"date":"2023-11-02T17:39:57.583231Z","timestamp":"Nov  2 10:38:11","query_type":"A","qname":"captive.apple.com","source_ip":"10.11.21.7","tag":"dns_file"}{"date":"2023-11-02T17:39:57.583238Z","timestamp":"Nov  2 10:38:11","query_type":"HTTPS","qname":"dns.google","source_ip":"10.11.21.7","tag":"dns_file"}{"date":"2023-11-02T17:39:57.583245Z","timestamp":"Nov  2 10:38:11","query_type":"A","qname":"dns.google","source_ip":"10.11.21.7","tag":"dns_file"}{"date":"2023-11-02T17:39:57.583251Z","timestamp":"Nov  2 10:38:11","query_type":"HTTPS","qname":"mesu.g.aaplimg.com","source_ip":"10.11.21.7","tag":"dns_file"}{"date":"2023-11-02T17:39:57.583258Z","timestamp":"Nov  2 10:38:11","query_type":"HTTPS","qname":"captive.g.aaplimg.com","source_ip":"10.11.21.7","tag":"dns_file"}{"date":"2023-11-02T17:39:57.583265Z","timestamp":"Nov  2 10:38:11","query_type":"A","qname":"www.google.com.ar","source_ip":"10.11.21.7","tag":"dns_file"}{"date":"2023-11-02T17:39:57.583271Z","timestamp":"Nov  2 10:38:11","query_type":"HTTPS","qname":"www.google.com.ar","source_ip":"10.11.21.7","tag":"dns_file"}{"date":"2023-11-02T17:39:57.583278Z","timestamp":"Nov  2 10:38:12","query_type":"SVCB","qname":"_dns.resolver.arpa","source_ip":"10.11.21.7","tag":"dns_file"}{"date":"2023-11-02T17:39:57.583285Z","timestamp":"Nov  2 10:38:12","query_type":"HTTPS","qname":"gsp85-ssl.ls.apple.com","source_ip":"10.11.21.7","tag":"dns_file"}{"date":"2023-11-02T17:39:57.583293Z","timestamp":"Nov  2 10:38:12","query_type":"A","qname":"gsp85-ssl.ls.apple.com","source_ip":"10.11.21.7","tag":"dns_file"}{"date":"2023-11-02T17:39:57.583300Z","timestamp":"Nov  2 10:38:12","query_type":"A","qname":"signaler-pa.clients6.google.com","source_ip":"10.11.2.40","tag":"dns_file"}{"date":"2023-11-02T17:39:57.583307Z","timestamp":"Nov  2 10:38:12","query_type":"HTTPS","qname":"signaler-pa.clients6.google.com","source_ip":"10.11.2.40","tag":"dns_file"}{"date":"2023-11-02T17:39:57.583315Z","timestamp":"Nov  2 10:38:12","query_type":"HTTPS","qname":"gateway.icloud.com","source_ip":"10.11.21.7","tag":"dns_file"}{"date":"2023-11-02T17:39:57.583322Z","timestamp":"Nov  2 10:38:12","query_type":"A","qname":"gateway.icloud.com","source_ip":"10.11.21.7","tag":"dns_file"}{"date":"2023-11-02T17:39:57.583329Z","timestamp":"Nov  2 10:38:12","query_type":"HTTPS","qname":"lcdn-locator.apple.com","source_ip":"10.11.21.7","tag":"dns_file"}{"date":"2023-11-02T17:39:57.583336Z","timestamp":"Nov  2 10:38:12","query_type":"A","qname":"lcdn-locator.apple.com","source_ip":"10.11.21.7","tag":"dns_file"}{"date":"2023-11-02T17:39:57.583343Z","timestamp":"Nov  2 10:38:12","query_type":"HTTPS","qname":"gsp85-ssl.ls2-apple.com.akadns.net","source_ip":"10.11.21.7","tag":"dns_file"}{"date":"2023-11-02T17:39:57.583349Z","timestamp":"Nov  2 10:38:12","query_type":"A","qname":"www.google.com","source_ip":"10.11.21.7","tag":"dns_file"}{"date":"2023-11-02T17:39:57.583356Z","timestamp":"Nov  2 10:38:12","query_type":"HTTPS","qname":"gateway.fe.apple-dns.net","source_ip":"10.11.21.7","tag":"dns_file"}{"date":"2023-11-02T17:39:57.583363Z","timestamp":"Nov  2 10:38:12","query_type":"A","qname":"outlook.office365.com","source_ip":"10.199.0.37","tag":"dns_file"}{"date":"2023-11-02T17:39:57.583370Z","timestamp":"Nov  2 10:38:12","query_type":"A","qname":"ocws.officeapps.live.com","source_ip":"10.199.0.37","tag":"dns_file"}{"date":"2023-11-02T17:39:57.583377Z","timestamp":"Nov  2 10:38:12","query_type":"AAAA","qname":"redacted.com","source_ip":"10.11.2.27","tag":"dns_file"}{"date":"2023-11-02T17:39:57.583384Z","timestamp":"Nov  2 10:38:12","query_type":"A","qname":"graph.microsoft.com","source_ip":"10.199.0.37","tag":"dns_file"}{"date":"2023-11-02T17:39:57.583390Z","timestamp":"Nov  2 10:38:12","query_type":"A","qname":"www.bing.com","source_ip":"10.11.21.6","tag":"dns_file"}{"date":"2023-11-02T17:39:57.583398Z","timestamp":"Nov  2 10:38:12","query_type":"HTTPS","qname":"www.bing.com","source_ip":"10.11.21.6","tag":"dns_file"}{"date":"2023-11-02T17:39:57.583405Z","timestamp":"Nov  2 10:3
17:39:57.838292 vethdc35943 P   IP 172.18.0.6.60068 > 172.18.0.30.10081: Flags [P.], seq 14616:16172, ack 1, win 502, options [nop,nop,TS val 4004168070 ecr 4268930297], length 1556
E..H.e@.@.............'aJ....}y5....^......
.....r..8:12","query_type":"A","qname":"exo.nel.measure.office.net","source_ip":"10.11.2.28","tag":"dns_file"}{"date":"2023-11-02T17:39:57.583411Z","timestamp":"Nov  2 10:38:12","query_type":"HTTPS","qname":"exo.nel.measure.office.net","source_ip":"10.11.2.28","tag":"dns_file"}{"date":"2023-11-02T17:39:57.583418Z","timestamp":"Nov  2 10:38:13","query_type":"A","qname":"substrate.office.com","source_ip":"10.199.0.37","tag":"dns_file"}{"date":"2023-11-02T17:39:57.583425Z","timestamp":"Nov  2 10:38:13","query_type":"A","qname":"api.steampowered.com","source_ip":"10.11.2.44","tag":"dns_file"}{"date":"2023-11-02T17:39:57.583431Z","timestamp":"Nov  2 10:38:13","query_type":"A","qname":"ipv6check-http.steamserver.net","source_ip":"10.11.2.44","tag":"dns_file"}{"date":"2023-11-02T17:39:57.583437Z","timestamp":"Nov  2 10:38:14","query_type":"A","qname":"a-ring-fallback.msedge.net","source_ip":"10.199.0.37","tag":"dns_file"}{"date":"2023-11-02T17:39:57.583444Z","timestamp":"Nov  2 10:38:14","query_type":"A","qname":"roaming.officeapps.live.com","source_ip":"10.199.0.151","tag":"dns_file"}{"date":"2023-11-02T17:39:57.583451Z","timestamp":"Nov  2 10:38:14","query_type":"A","qname":"www.msftconnecttest.com","source_ip":"10.11.21.25","tag":"dns_file"}{"date":"2023-11-02T17:39:57.583457Z","timestamp":"Nov  2 10:38:14","query_type":"A","qname":"r.bing.com","source_ip":"10.199.0.37","tag":"dns_file"}{"date":"2023-11-02T17:39:57.583464Z","timestamp":"Nov  2 10:38:14","query_type":"A","qname":"redacted3.com","source_ip":"10.199.0.166","tag":"dns_file"}
17:39:57.838299 veth01df584 Out IP 172.18.0.6.60068 > 172.18.0.30.10081: Flags [P.], seq 14616:16172, ack 1, win 502, options [nop,nop,TS val 4004168070 ecr 4268930297], length 1556
E..H.e@.@.............'aJ....}y5....^......
.....r..8:12","query_type":"A","qname":"exo.nel.measure.office.net","source_ip":"10.11.2.28","tag":"dns_file"}{"date":"2023-11-02T17:39:57.583411Z","timestamp":"Nov  2 10:38:12","query_type":"HTTPS","qname":"exo.nel.measure.office.net","source_ip":"10.11.2.28","tag":"dns_file"}{"date":"2023-11-02T17:39:57.583418Z","timestamp":"Nov  2 10:38:13","query_type":"A","qname":"substrate.office.com","source_ip":"10.199.0.37","tag":"dns_file"}{"date":"2023-11-02T17:39:57.583425Z","timestamp":"Nov  2 10:38:13","query_type":"A","qname":"api.steampowered.com","source_ip":"10.11.2.44","tag":"dns_file"}{"date":"2023-11-02T17:39:57.583431Z","timestamp":"Nov  2 10:38:13","query_type":"A","qname":"ipv6check-http.steamserver.net","source_ip":"10.11.2.44","tag":"dns_file"}{"date":"2023-11-02T17:39:57.583437Z","timestamp":"Nov  2 10:38:14","query_type":"A","qname":"a-ring-fallback.msedge.net","source_ip":"10.199.0.37","tag":"dns_file"}{"date":"2023-11-02T17:39:57.583444Z","timestamp":"Nov  2 10:38:14","query_type":"A","qname":"roaming.officeapps.live.com","source_ip":"10.199.0.151","tag":"dns_file"}{"date":"2023-11-02T17:39:57.583451Z","timestamp":"Nov  2 10:38:14","query_type":"A","qname":"www.msftconnecttest.com","source_ip":"10.11.21.25","tag":"dns_file"}{"date":"2023-11-02T17:39:57.583457Z","timestamp":"Nov  2 10:38:14","query_type":"A","qname":"r.bing.com","source_ip":"10.199.0.37","tag":"dns_file"}{"date":"2023-11-02T17:39:57.583464Z","timestamp":"Nov  2 10:38:14","query_type":"A","qname":"redacted3.com","source_ip":"10.199.0.166","tag":"dns_file"}
17:39:57.839034 vethdc35943 P   IP 172.18.0.6.60068 > 172.18.0.30.10081: Flags [.], ack 119, win 502, options [nop,nop,TS val 4004168071 ecr 4268930297], length 0
E..4.g@.@.4...........'aJ....}y.....Xo.....
.....r..
17:39:57.839049 veth01df584 Out IP 172.18.0.6.60068 > 172.18.0.30.10081: Flags [.], ack 119, win 502, options [nop,nop,TS val 4004168071 ecr 4268930297], length 0
E..4.g@.@.4...........'aJ....}y.....Xo.....
.....r..
^C
14 packets captured
52 packets received by filter
0 packets dropped by kernel
```
So, the conclusion is that FluentBit (and I think Fluentd is doing the same) is sending all the events, but eKuiper HTTP Push Source only "understand" the first event, and the rest is dropped. So I think it's a format problem, but I already tried with all the available formats on FluentBit/Fluentd. The strange part is that I have configured FluentBit HTTP Output Plugin sending these same events to OpenObserve and Parseable without any issues. The only difference is that in both cases I setted up gzip compression, and the configured format for the output is json, not json_lines, but eKuiper with json can't receive any event, throwing this error:
`fail to decode data &{%!s(*io.LimitedReader=&{0xc00101cde0 0}) <nil> %!s(*bufio.Reader=<nil>) %!s(bool=false) %!s(bool=true) {%!s(int32=0) %!s(uint32=0)} %!s(bool=true) %!s(bool=false) %!s(bool=false) %!s(func()=0x1008b60)}: json: cannot unmarshal array into Go value of type map[string]interface {}
`
So that is the best troubleshooting that I can do. If I cannot use FluentBit or Fluentd for this use case, maybe you can tell me which is your preferred collector that can work with eKuiper HTTP Push Source.
Thanks again for all your help and you patience.

**Reply by ngjaying** [reply]
Great that we finally have some progress. Currently, httppush source only supports  json map, not json array. We can open a feature request to allow json array input. Just curious, if it is a format problem, why you don't see the decode error problem in previous logs?

**Reply by canob** [reply]
@ngjaying , why are you saying that FluentBit is sending a json array to httppush source? The configured format in FluentBit for HTTP Output is json_lines, so at my understanding it is sending a json map one after the other and so on, until sending the 100 events in this case. Do not get confused with the content of /tmp/fluentbit_output/dns_file, because when FluentBit send events to a file add a preffix with the tag, and create an array for each event with the timestamp in epoch and all the message log.
If you review the tcpdump, which has the exactly information that is being send to the eKuiper httppush source on port 10081, you can see one json map after the other, for example:
```
.....r..{"date":"2023-11-02T17:39:57.582689Z","timestamp":"Nov  2 10:38:05","query_type":"A","qname":"comm-cohort.ess.apple.com","source_ip":"10.11.21.7","tag":"dns_file"}{"date":"2023-11-02T17:39:57.582717Z","timestamp":"Nov  2 10:38:05","query_type":"A","qname":"roaming.officeapps.live.com","source_ip":"10.199.0.145","tag":"dns_file"}{"date":"2023-11-02T17:39:57.582726Z","timestamp":"Nov  2 10:38:05","query_type":"A","qname":"ntp.msn.com","source_ip":"10.11.0.50","tag":"dns_file"}...
```
I only see the decode error on eKuiper when I config as output format json or msgpack on HTTP Output, and is reasonable thinking in what you told me, because both are JSON array formats.
My idea, that obviously can be wrong, is that eKuiper httppush source cannot "detect" or "understand" the end of one json map and the start of the other, maybe because is expecting a \n between both, or a separator, or I don't know.

**Reply by canob** [reply]
Added a question on FluentBit Github about this too:
https://github.com/fluent/fluent-bit/discussions/8125

**Reply by ngjaying** [reply]
Do you know the http body of each format?

**Reply by canob** [reply]
No, but I can try to put a HTTP Proxy or API Gateway in the middle of FluentBit and eKuiper to get and example for each of them.

**Reply by canob** [reply]
Hi @ngjaying,
Thanks to https://github.com/socsieng/capture-proxy, attached all the requests of FluentBit and the responses of eKuiper using the four formats of FluentBit HTTP Output: msgpack, json, json_stream, json_lines.
The tree events that I send on every test:
```
{"qname":"comm-cohort.ess.apple.com","source_ip":"10.11.21.7","timestamp":"Nov  2 10:38:05","tag":"dns_query","query_type":"A"}
{"qname":"roaming.officeapps.live.com","source_ip":"10.199.0.145","timestamp":"Nov  2 10:38:05","tag":"dns_query","query_type":"A"}
{"query_type":"A","timestamp":"Nov  2 10:38:05","tag":"dns_query","source_ip":"10.11.0.50","qname":"ntp.msn.com"}
```
Let me know if that is what you asked for.

[captures.zip](https://github.com/lf-edge/ekuiper/files/13251229/captures.zip)

**Reply by ngjaying** [reply]
What format do you use when encountering random lost? It seems json_stream, json_lines are send out multiple json maps in one request. eKuiper may only decode one of them.

**Reply by canob** [reply]
I used json_stream and json_lines format, and the result was just what you are saying, got only the first event. With msgpack and json format I got no events and an error on eKuiper logs that cannot decode.
I think FluentBit send more than an event by request because of performance (send only one event by request maybe is slower), and the other tools with HTTP Input that I used (OpenObserve, Parseable, Grafana Loki) can manage that and receive all the events, so it is possible to eKuiper in the future understand and receive all the events with some of these formats too with HTTP Push Source?
Plan B is add EMQX MQTT Broker and Fluentd (to have MQTT Output, because FluentBit doesn't have it) between FluentBit and eKuiper, but it is adding two additional tools to the pipeline to manage and care about. eKuiper File Source is not an option too because what you already told me about that is not designed for "realtime" data transfer, because of how manage the processed files (process files, not reading them as a "tail").

**Reply by ngjaying** [reply]
It's a good idea to support these formats. You can create a feature request. Thanks.
